{
  "ronda": "13",
  "revisor": "GPT-6 Astra",
  "resumen": "Rechazado. Pasan las 270 pruebas de aceptación y las 20 verificaciones adaptadas. Los 26 ataques adicionales producen 5 aprobaciones y 21 fallos, agrupados en ocho hallazgos nuevos: siete altos y uno medio. Reproduje exactamente el JSON de la muestra, el informe 14 y los resúmenes Q0/A1 de la demo. Audité 103 paquetes y 6.901 documentos: ninguna barra posterior al corte ni diferencia de características. Las cifras y el recuento de 270 pruebas del README se sostienen. Persisten filtraciones por metadatos, validación incompleta de derechos, etiquetas falsas tras descartes, retiradas indebidamente emparejadas y redondeo que inmoviliza lotes. Evidencias en review/out/astra_scratch/test_r13_*.py, r13_attacks_final_log.txt y r13_real/audit.json. Sólo escribí bajo astra_scratch; no ejecuté descargas ni modifiqué código del constructor.",
  "hallazgos": [
    {
      "id": "R09-03/verificacion",
      "severidad": "alta",
      "categoria": "seguridad",
      "archivo": "src/twlab/packet.py",
      "linea": 496,
      "afirmacion": "Corregida la vía concreta de doc_id rechazado; quedan otras vías en R13-01.",
      "contraejemplo": "El identificador con espacios se rechaza y 'profit-in-2099-999-buy-A' desaparece de los rechazos visibles, tanto en histórico como en prospectivo.",
      "comando_reproduccion": "python -B -m pytest -q -p no:cacheprovider review/out/astra_scratch/test_r13_verifications.py -k rejected_doc_id --basetemp review/out/astra_scratch/repro13_rejection",
      "prueba_propuesta": null,
      "estado_verificacion": "reproducido"
    },
    {
      "id": "R10-05/verificacion",
      "severidad": "alta",
      "categoria": "identidad",
      "archivo": "src/twlab/backtest.py",
      "linea": 199,
      "afirmacion": "Corregido: captures.delisting_date se incorpora y las declaraciones contradictorias se rechazan.",
      "contraejemplo": "Con retirada declarada el 09-01-2024, la compra del 08-01 no se vende el 12-01; la contradicción entre captures y delisted provoca ManifestInconsistent.",
      "comando_reproduccion": "python -B -m pytest -q -p no:cacheprovider tests/test_backtest.py review/out/astra_scratch/test_r13_verifications.py -k 'delisting_date_declared or captures_delisting' --basetemp review/out/astra_scratch/repro13_delisting",
      "prueba_propuesta": null,
      "estado_verificacion": "reproducido"
    },
    {
      "id": "R10-10/verificacion",
      "severidad": "baja",
      "categoria": "especificacion",
      "archivo": "docs/informes/16_respuesta_ronda10_astra.md",
      "linea": 35,
      "afirmacion": "Corregido: el informe 16 distingue cortes decrecientes de cortes iguales.",
      "contraejemplo": "§3.1 dice que un corte anterior se rechaza y uno igual se admite, coherentemente con cutoff_at < last_cutoff.",
      "comando_reproduccion": "python -B -m pytest -q -p no:cacheprovider review/out/astra_scratch/test_r13_verifications.py -k report16 --basetemp review/out/astra_scratch/repro13_report16",
      "prueba_propuesta": null,
      "estado_verificacion": "reproducido"
    },
    {
      "id": "R11-01/verificacion",
      "severidad": "media",
      "categoria": "tiempo",
      "archivo": "src/twlab/backtest.py",
      "linea": 278,
      "afirmacion": "Corregida la política de fechas sin hora: se utiliza derive_available_at y se declara conservative_inference.",
      "contraejemplo": "Un anuncio del sábado 13-01-2024 sin hora queda disponible el lunes 15-01 a las 09:00; la etiqueta no entra en el entrenamiento del domingo 14-01 a las 18:00.",
      "comando_reproduccion": "python -B -m pytest -q -p no:cacheprovider review/out/astra_scratch/test_r13_verifications.py -k saturday_announcement --basetemp review/out/astra_scratch/repro13_dateonly",
      "prueba_propuesta": null,
      "estado_verificacion": "reproducido"
    },
    {
      "id": "R12-01/verificacion",
      "severidad": "alta",
      "categoria": "contabilidad",
      "archivo": "src/twlab/backtest.py",
      "linea": 296,
      "afirmacion": "Parcial: existe la lista compartida y pasan los contraejemplos anteriores, pero su validación y sus descartes siguen siendo incorrectos.",
      "contraejemplo": "Las filas de 2 y 10 TWD, y la combinación de pago anterior a ex con fila válida, se descartan sin depender del orden. Sin embargo, cero, importes no finitos, periodos vacíos y known_at distintos producen R13-02..R13-05.",
      "comando_reproduccion": "python -B -m pytest -q -p no:cacheprovider review/out/astra_scratch/test_r13_verifications.py -k 'conflicting_same_event or invalid_first_duplicate or event_parity or single_dividend' --basetemp review/out/astra_scratch/repro13_shared",
      "prueba_propuesta": null,
      "estado_verificacion": "reproducido"
    },
    {
      "id": "R12-02/verificacion",
      "severidad": "alta",
      "categoria": "contabilidad",
      "archivo": "src/twlab/backtest.py",
      "linea": 439,
      "afirmacion": "Parcial: el caso original y la frontera de la sesión quedan cubiertos; las retiradas conservan un intervalo indebidamente medible en R13-06.",
      "contraejemplo": "El derecho durante la semana cerrada genera price_predates_right. También lo genera un derecho del propio día de valoración cuando falta su barra; con precio de esa sesión no lo genera. Una posición delisted elude esta comprobación.",
      "comando_reproduccion": "python -B -m pytest -q -p no:cacheprovider review/out/astra_scratch/test_r13_verifications.py review/out/astra_scratch/test_r13_attacks.py -k 'no_session_stock_action or right_exactly_on_valuation' --basetemp review/out/astra_scratch/repro13_marks",
      "prueba_propuesta": null,
      "estado_verificacion": "reproducido"
    },
    {
      "id": "R12-03/verificacion",
      "severidad": "media",
      "categoria": "contrato",
      "archivo": "src/twlab/backtest.py",
      "linea": 787,
      "afirmacion": "Corregido: el bootstrap degenerado publica ci95=null y admite serialización JSON estricta.",
      "contraejemplo": "Una semana con bloque 1 conserva degenerate=True y una observación fija; json.dumps(..., allow_nan=False) termina correctamente.",
      "comando_reproduccion": "python -B -m pytest -q -p no:cacheprovider tests/test_backtest.py review/out/astra_scratch/test_r13_verifications.py -k 'serialises_without_nan or strict_json or degenerate_markdown' --basetemp review/out/astra_scratch/repro13_json",
      "prueba_propuesta": null,
      "estado_verificacion": "reproducido"
    },
    {
      "id": "R12-04/verificacion",
      "severidad": "media",
      "categoria": "estadistica",
      "archivo": "docs/informes/11_demo_q0_2024-2025.md",
      "linea": 60,
      "afirmacion": "Corregido: el informe 11 declara la observación fija y la variabilidad limitada.",
      "contraejemplo": "La tabla identifica 2025-W04 como una observación fija de 100, coincidiendo con el JSON reproducido.",
      "comando_reproduccion": "python -B -m pytest -q -p no:cacheprovider review/out/astra_scratch/test_r13_verifications.py -k report11 --basetemp review/out/astra_scratch/repro13_report11",
      "prueba_propuesta": null,
      "estado_verificacion": "reproducido"
    },
    {
      "id": "R13-01",
      "severidad": "alta",
      "categoria": "seguridad",
      "archivo": "src/twlab/packet.py",
      "linea": 496,
      "afirmacion": "El predictor sigue recibiendo texto libre no respaldado por documentos admitidos ni por la extracción autorizada.",
      "contraejemplo": "Con cero documentos, packet_id, evidence_class y calendar_version transportan 'profit in 2099 = 999; buy A' tras serialización, readmission_problems=[] y PredictorView.packet(), en ambos modos. Además, un documento prospectivo cuyo extractor sólo devuelve {'allowed': 1} admite ese texto en kind o supersedes. El control de security_ids sí rechaza una identidad distinta de la extraída.",
      "comando_reproduccion": "python -B -m pytest -q -p no:cacheprovider review/out/astra_scratch/test_r13_attacks.py -k 'free_packet_metadata or admitted_metadata' --basetemp review/out/astra_scratch/repro13_metadata",
      "prueba_propuesta": "from datetime import date, time\nfrom twlab.packet import build_packet, packet_from_json, packet_to_json, readmission_problems, PredictorView\nfrom twlab.store import RawStore\nfrom twlab.timeutil import taipei\n\ndef test_packet_id_cannot_carry_future_content(tmp_path):\n    marker = 'profit in 2099 = 999; buy A'\n    p = build_packet(packet_id=marker, cutoff_at=taipei(date(2024,1,7), time(18)), documents=[], mode='prospective', evidence_class='prospective_registered', captures={}, read_bytes=lambda r: b'', extractors={})\n    p = packet_from_json(packet_to_json(p))\n    assert readmission_problems(p, store=RawStore(tmp_path/'raw')) or marker not in PredictorView(p).packet().packet_id\n",
      "estado_verificacion": "reproducido"
    },
    {
      "id": "R13-02",
      "severidad": "alta",
      "categoria": "contabilidad",
      "archivo": "src/twlab/backtest.py",
      "linea": 308,
      "afirmacion": "Filtrar importes no positivos antes de agrupar oculta colisiones y filas inválidas del mismo derecho.",
      "contraejemplo": "Para A, periodo 2024 y fecha ex 10-01-2024, las filas de efectivo 10 y 0 TWD producen un único derecho de 10, warnings=[] y retorno +10 %. En acciones, 10 y 0 producen +100 %. Sustituir cero por −1 tampoco invalida el evento. Esto contradice el descarte completo anunciado en el informe 18.",
      "comando_reproduccion": "python -B -m pytest -q -p no:cacheprovider review/out/astra_scratch/test_r13_attacks.py -k zero_or_negative --basetemp review/out/astra_scratch/repro13_zero",